{
  "$schema": "https://json-schema.org/draft/2020-12/schema",
  "title": "TableCatalog",
  "description": "Per-table catalog file produced by setup-ddl. Contains catalog signals and inbound references.",
  "type": "object",
  "required": ["schema", "name", "primary_keys", "unique_indexes", "foreign_keys", "auto_increment_columns", "referenced_by"],
  "properties": {
    "schema": { "type": "string", "description": "Schema name, e.g. silver" },
    "name": { "type": "string", "description": "Object name, e.g. DimCustomer" },
    "columns": {
      "type": "array",
      "description": "Column definitions from sys.columns. Populated by export_ddl.",
      "items": {
        "type": "object",
        "required": ["name", "sql_type", "is_nullable", "is_identity"],
        "properties": {
          "name": { "type": "string" },
          "sql_type": { "type": "string", "description": "Formatted SQL type, e.g. NVARCHAR(50), BIGINT" },
          "is_nullable": { "type": "boolean" },
          "is_identity": { "type": "boolean" }
        }
      }
    },
    "primary_keys": {
      "type": "array",
      "items": {
        "type": "object",
        "required": ["constraint_name", "columns"],
        "properties": {
          "constraint_name": { "type": "string" },
          "columns": { "type": "array", "items": { "type": "string" } }
        }
      }
    },
    "unique_indexes": {
      "type": "array",
      "items": {
        "type": "object",
        "required": ["index_name", "columns"],
        "properties": {
          "index_name": { "type": "string" },
          "columns": { "type": "array", "items": { "type": "string" } }
        }
      }
    },
    "foreign_keys": {
      "type": "array",
      "items": {
        "type": "object",
        "required": ["constraint_name", "columns", "referenced_schema", "referenced_table", "referenced_columns"],
        "properties": {
          "constraint_name": { "type": "string" },
          "columns": { "type": "array", "items": { "type": "string" } },
          "referenced_schema": { "type": "string" },
          "referenced_table": { "type": "string" },
          "referenced_columns": { "type": "array", "items": { "type": "string" } }
        }
      }
    },
    "auto_increment_columns": {
      "type": "array",
      "description": "Columns with automatic sequence generation. Normalized from identity (SQL Server), autoincrement (Snowflake), or generated always (Spark).",
      "items": {
        "type": "object",
        "required": ["column"],
        "properties": {
          "column": { "type": "string" },
          "seed": { "type": "integer" },
          "increment": { "type": "integer" },
          "mechanism": {
            "type": "string",
            "enum": ["identity", "autoincrement", "sequence", "generated_always"],
            "description": "Source mechanism. Informational only — downstream agents use presence/absence, not mechanism."
          }
        }
      }
    },
    "change_capture": {
      "type": "object",
      "description": "Change-tracking metadata. Optional — absent means not detected or not applicable.",
      "properties": {
        "enabled": { "type": "boolean" },
        "mechanism": {
          "type": "string",
          "enum": ["cdc", "change_tracking", "stream", "change_data_feed"],
          "description": "Source mechanism: cdc/change_tracking (SQL Server), stream (Snowflake), change_data_feed (Delta/Spark)."
        }
      }
    },
    "sensitivity_classifications": {
      "type": "array",
      "items": {
        "type": "object",
        "required": ["column", "label", "information_type"],
        "properties": {
          "column": { "type": "string" },
          "label": { "type": "string" },
          "information_type": { "type": "string" }
        }
      }
    },
    "technology_metadata": {
      "type": "object",
      "description": "Technology-specific metadata with no cross-platform equivalent. Keyed by technology name. Downstream agents may inspect but must not require.",
      "additionalProperties": true
    },
    "referenced_by": { "$ref": "#/$defs/reference_groups" },
    "profile": {
      "description": "Written by the /profile skill or profiler agent. Not present after setup-ddl, only after profiling.",
      "$ref": "#/$defs/profile_section"
    }
  },
  "$defs": {
    "reference_groups": {
      "type": "object",
      "description": "Inbound references grouped by object type. Each type splits into in_scope and out_of_scope.",
      "required": ["procedures", "views", "functions"],
      "properties": {
        "procedures": { "$ref": "common.json#/$defs/scoped_ref_list" },
        "views": { "$ref": "common.json#/$defs/scoped_ref_list" },
        "functions": { "$ref": "common.json#/$defs/scoped_ref_list" }
      }
    },
    "profile_section": {
      "type": "object",
      "required": ["status", "writer"],
      "properties": {
        "status": { "type": "string", "enum": ["ok", "partial", "error"] },
        "writer": { "type": "string" },
        "classification": {
          "type": "object",
          "properties": {
            "resolved_kind": {
              "type": "string",
              "enum": ["dim_non_scd", "dim_scd1", "dim_scd2", "dim_junk", "fact_transaction", "fact_periodic_snapshot", "fact_accumulating_snapshot", "fact_aggregate"]
            },
            "rationale": { "type": "string" },
            "source": { "type": "string", "enum": ["catalog", "llm", "catalog+llm"] }
          }
        },
        "primary_key": {
          "type": "object",
          "properties": {
            "columns": { "type": "array", "items": { "type": "string" } },
            "primary_key_type": { "type": "string", "enum": ["surrogate", "natural", "composite", "unknown"] },
            "source": { "type": "string", "enum": ["catalog", "llm", "catalog+llm"] }
          }
        },
        "natural_key": {
          "type": "object",
          "properties": {
            "columns": { "type": "array", "items": { "type": "string" } },
            "rationale": { "type": "string" },
            "source": { "type": "string", "enum": ["catalog", "llm", "catalog+llm"] }
          }
        },
        "watermark": {
          "type": "object",
          "properties": {
            "column": { "type": "string" },
            "rationale": { "type": "string" },
            "source": { "type": "string", "enum": ["catalog", "llm", "catalog+llm"] }
          }
        },
        "foreign_keys": {
          "type": "array",
          "items": {
            "type": "object",
            "properties": {
              "column": { "type": "string" },
              "references_source_relation": { "type": "string" },
              "references_column": { "type": "string" },
              "fk_type": { "type": "string", "enum": ["standard", "role_playing", "degenerate"] },
              "source": { "type": "string", "enum": ["catalog", "llm", "catalog+llm"] }
            }
          }
        },
        "pii_actions": {
          "type": "array",
          "items": {
            "type": "object",
            "properties": {
              "column": { "type": "string" },
              "entity": { "type": "string" },
              "suggested_action": { "type": "string", "enum": ["mask", "drop", "tokenize", "keep"] },
              "source": { "type": "string", "enum": ["catalog", "llm", "catalog+llm"] }
            }
          }
        },
        "warnings": { "type": "array", "items": { "$ref": "common.json#/$defs/diagnostics_entry" } },
        "errors": { "type": "array", "items": { "$ref": "common.json#/$defs/diagnostics_entry" } }
      }
    }
  }
}
