{
  "schema": "silver",
  "name": "DimDate",
  "primary_keys": [],
  "unique_indexes": [],
  "foreign_keys": [],
  "auto_increment_columns": [],
  "referenced_by": {
    "procedures": {"in_scope": [], "out_of_scope": []},
    "views": {"in_scope": [], "out_of_scope": []},
    "functions": {"in_scope": [], "out_of_scope": []}
  }
}
