{
  "schema": "silver",
  "name": "FactSales",
  "columns": [
    { "name": "sale_id", "sql_type": "BIGINT", "is_nullable": false, "is_identity": true },
    { "name": "customer_key", "sql_type": "BIGINT", "is_nullable": false, "is_identity": false },
    { "name": "product_key", "sql_type": "BIGINT", "is_nullable": false, "is_identity": false },
    { "name": "order_date_key", "sql_type": "INT", "is_nullable": false, "is_identity": false },
    { "name": "ship_date_key", "sql_type": "INT", "is_nullable": false, "is_identity": false },
    { "name": "amount", "sql_type": "DECIMAL(18,2)", "is_nullable": false, "is_identity": false },
    { "name": "quantity", "sql_type": "INT", "is_nullable": false, "is_identity": false },
    { "name": "customer_email", "sql_type": "NVARCHAR(255)", "is_nullable": true, "is_identity": false },
    { "name": "load_date", "sql_type": "DATETIME2", "is_nullable": false, "is_identity": false }
  ],
  "primary_keys": [
    {
      "constraint_name": "PK_FactSales",
      "columns": ["sale_id"]
    }
  ],
  "unique_indexes": [],
  "foreign_keys": [
    {
      "constraint_name": "FK_FactSales_DimCustomer",
      "columns": ["customer_key"],
      "referenced_schema": "silver",
      "referenced_table": "DimCustomer",
      "referenced_columns": ["customer_key"]
    }
  ],
  "auto_increment_columns": [
    { "column": "sale_id", "mechanism": "identity", "seed": 1, "increment": 1 }
  ],
  "change_capture": { "enabled": true, "mechanism": "cdc" },
  "sensitivity_classifications": [
    { "column": "customer_email", "label": "Confidential", "information_type": "Contact Info" }
  ],
  "referenced_by": {
    "procedures": {
      "in_scope": [
        {
          "schema": "dbo",
          "name": "usp_load_fact_sales",
          "is_selected": false,
          "is_updated": true,
          "is_insert_all": false,
          "columns": [
            { "name": "sale_id", "is_selected": true, "is_updated": false },
            { "name": "amount", "is_selected": false, "is_updated": true }
          ]
        }
      ],
      "out_of_scope": []
    },
    "views": {
      "in_scope": [],
      "out_of_scope": []
    },
    "functions": {
      "in_scope": [],
      "out_of_scope": []
    }
  }
}
